,Common Name,Botanical Name,Family,Plant Type,Mature Size,Sun Exposure,Soil Type,Soil pH,Bloom Time,Flower Color,Hardiness Zones,Native Area,Toxicity
301,Black Hills Spruce,Picea glauca 'densata',Pinaceae,Coniferous Evergreen,20-25 Feet Tall 10-15 Feet Tall,Full Sun,"Moist, well-drained",Acidic,Non-flowering,Non-flowering,USDA 3 to 6,Black Hills of South Dakota,
302,Western juniper,Juniperus occidentalis,Cupressaceae,"Coniferous shrub, tree","12–50 ft. tall, 10–40 ft. wide",Full to partial,"Dry to medium moisture, rocky",Slightly acidic to slightly alkaline (6.0 to 8.0),Cones/berries mature in fall,Blue/purple berries have white coating,5-9 (USDA),West to Pacific Northwest United States,
303,Western sword fern,Polystichum munitum,Dryopteridaceae,"Evergreen, rhizome","2-4 ft. tall, 2-4 ft. wide (outdoors); 1-2 ft. tall, 1-2 ft. wide (indoors)","Partial, shade",Moist but well-drained,Acidic,,N/A.,5 to 9,North America,
304,"Wheat, bread wheat",Triticum aestivum,,Grass,2-4 ft. tall,Full sun,Well drained loam,Neutral,May (anthers appear),Bright yellow,7-10 (USDA),Western Asia,
305,White ash,Fraxinus americana,Oleaceae,Deciduous tree,"60–80 ft. tall, 60–80 ft. wide",Full,"Rich, loamy, moist but well-draining",Acidic to alkaline (6.0 to 8.0),April to May,Purplish,3–9 (USDA),Eastern North America,
306,White batflower,Tacca integrifolia,,Tropical herb,2 to 3 feet tall,"Partial shade, shade","Loamy, well-draining",6 to 7,Mid-spring to early fall,"White, purple",10 to 11 (USA) or indoors,Tropical and subtropical Asia,
307,"Silver Birch, White Birch",Betula pendula,,Tree,30-40ft. tall 15-30ft. wide,Full Sun- Part Shade,"Medium to wet, well-drained sandy",Prefers soil below 6.5,March to April,Yellowish brown or Green,USDA 2-6,Europe and Asia,
308,White clover,Trifolium repens,Fabaceae,Herbaceous perennial,"0.25-0.50 ft. tall, 1-1.50 ft. wide","Full, partial","Well-drained, moist",Acidic,"Spring, summer",White,3-10 (USDA),Europe,"Plant itself is non-toxic, contracts fungus toxic to horses"
309,"White feather hosta, plantain lily",Hosta 'White Feather',Asparagaceae,Perennial,"12-20 in. tall, 20-24 in. wide","Partial, shade",Moist but well-drained,"Acidic, neutral, alkaline (6.5 to 7.5)",Mid-summer,Lavender,3-9 (USDA),Northeast Asia,
310,White Fir,Abies concolor,Pinaceae,Conifer,"40-50 ft. tall, 20-30 ft. wide",Full sun,"Sandy, well-drained soil",Slightly Acidic,Non-flowering,Non-flowering,"3 to 7, USDA","Western United States, Mexico",
311,"White Frangipani, White Plumeria",Plumeria alba,Apocynaceae,Tree,"20-25 ft. tall, 20-25 ft. wide","Full, partial","Loamy, sandy, well-drained","Acidic, neutral","Summer, fall","White, yellow","10-11, USDA",Puerto Rico and the Lesser Antilles,
312,Black huckleberry,Gaylussacia baccata,,Perennial shrub,5' tall,Part shade,"Sandy, rocky",4.3-5.2,Spring,"Yellow, pink",03-Jul,North America,
313,"White lace flower, Minoan lacea",Orlaya grandiflora,Apiaceae,Herbaceous annual,"2–3 ft. tall, 1 ft. wide","Full, partial",Moist but well-drained,Acidic to alkaline (6.0 to 8.0),"Summer, fall",White,2-11 (true annual),Europe,
314,White mulberry,Morus alba,Moraceae,Deciduous tree,"30-60 ft. tall, 20-40 ft. wide",Full sun to part shade,"Rich, moist, well-drained soil",Adaptable,Early spring,Yellowish green,4 to 8 (USDA),China,
315,White Oak,Quercus alba,,Deciduous,"60-100 ft. tall, 50-90 ft. wide",Full sun,"Rich, moist, well-drained, loamy",5.5-6.5,May,Yellow-Green,USDA 3-9,Eastern United States,
316,White Willow,Salix alba,Salicaceae,Deciduous tree,"50-80 ft. tall, 40-70 ft. wide",Full sun to part shade,"Medium to wet, well-drained",5.5 to 8.0,May,"Yellow (male), Green (female)",USDA 2-8,"Europe, northern Africa to central Asia",
317,White wonder cucumber,Cucumis sativus 'White Wonder',,Annual vegetable,"12 inches tall, 36 to 72 inches wide",Full sun,"Fertile, well-draining",Neutral (7.0),Spring,Yellow,3 to 9 (USDA),United States,
318,Rocky Mountain juniper,Juniperus scopulorum 'Wichita Blue',Cupressaceae,Needled evergreen,10 to 15 tall 4 to 6 feet wide.,Full sun,Adaptable to many soils except wet,5.0-7.5,,,USDA-3-7,Western North America,
319,"Sweet cherry, wild cherry, gean",Prunus avium,,Deciduous tree,Up to 65 ft. tall,"Full sun, partial shade",Moist but well-drained,"Tolerant of a wide variety, but prefers slightly acidic",Early spring,White,"4 to 7, USDA","Asia, Africa, Europe",Stems leaves and seeds toxic to humans and pets if ingested
320,"Lion's Tail, Wild Dagga",Leonotis leonurus,Lamiaceae,Shrub,4-6 ft. tall,Full,"Well-drained, loamy, sandy","Neutral, alkaline",Varies,Orange,"8, 9, 10, 11",Africa,
321,"Wild geranium, cranesbill, spotted geranium",Geranium maculatum,Geraniaceae,Perennial,18-24 in. tall,Part sun to full shade,"Moist, rich, acidic",4.5 - 6.8,Early spring to late summer,"Pinks, white, purple","5-8, USA","Europe, North America",
322,"Woodland Ginger, Ginger Root, Heart Snakeroot",Asarum Canadense,,Herbaceous perennial,"6"" tall",Shade,"Moist, rich","Slightly acidic, 5.0 - 6.0",April - June,Dark red,3 to 7,"Eastern North America, Southeastern Canada",
323,Black lace elderberry,Sambucus nigra 'Eva' BLACK LACE®,Viburnaceae,Deciduous shrub,"6–8 feet tall, 6–8 feet wide",Full to partial,"Humusy, moist but well drained",Slightly acidic to neutral,June to July,Light pink,4–7 (USDA),Cultivar; no native range (parent species is a European native),"Toxic to humans, pets"
324,Wild Raspberry or Wild Red Raspberry,Rubus idaeus,Rosaceae,"Perennial, fruit, shrub","3-9 ft. tall, 3-9 ft. wide","Full sun, partial shade",Well-drained,Acidic,"Summer, fall",White,4 to 8 (USDA),"North America, Europe, Northern Asia",
325,"Common grape, European grape, wine grape",Vitis vinifera,,"Woody, deciduous, fruiting vine","Can grow 40–60 ft. long, usually pruned to 3–9 ft. high, with a similar spread, for wine production",Full sun,"Well-drained, rich, loamy, medium-moist",6.5,May to June,Light green,"6 to 9, USA",Europe and Southwestern Asia,Toxic to dogs
326,"Burning bush, winged spindle tree",Euonymus alatus,Celastraceae,Shrub,"3-20 ft. tall, 3-12 ft. wide","Full, partial",Moist but well-drained,"Acidic, neutral, alkaline",Spring,Yellow,4-8 (USDA),Asia,"Mildly toxic to humans, toxic to dogs, cats, and horses"
327,Winter aconite,Eranthis hyemalis,Ranunculaceae,Perennial,6 in. tall,"Full sun, partial sun",Well-drained,Alkaline,Spring,Yellow,3-7 (USDA),Europe,Toxic to humans and animals
328,Winter Gem Boxwood,Buxus sinica var. insularis ‘Winter Gem’ or Buxus microphylla japonica 'Winter Gem',,Broadleaf evergreen,2 to 3 feet tall 2 to 3 feet wide,"Full Sun, Park Shade","Moist, sandy loams with good drainage",Neutral,April,Yellowish-Green,05-Sep,"China, Japan and Korea",Toxic to pets
329,Winter Squash,Cucurbita maxima,Cucurbitaceae,Vegetable,"9-30 in. tall, 10-12 ft. spread",Full sun,Loamy,Slightly acidic to neutral,Summer,"Orange, Yellow","3-9, USDA",North America,
330,"Wintercreeper euonymus, wintercreeper",Euonymus fortunei,Celastraceae,"Perennial, herbaceous","Up to 70 ft. as a vine, 2-4 ft. as a shrub","Full, partial",Well-drained,"Acidic, neutral, alkaline",,,5 to 9 (USDA),Asia,"Toxic to humans, toxic to pets"
331,Wintergreen Boxwood,Buxus sinica var. insularis 'Wintergreen' Buxus microphylla var. koreana.,,Broadleaf evergreen,2 to 4 feet tall 2 to 3 feet wide,Full Sun,"Moist, sandy loams with good drainage",Neutral,April,Greenish Yellow,"4-9, USA","China, Japan and Korea",Toxic to pets
332,"Wintersweet, Japanese allspice",Chimonanthus praecox,Calycanthaceae,Deciduous shrub,"10-15 ft. tall, 8-12 ft. wide","Full, partial","Fertile, moist but well-drained",Acidic to alkaline (6.0-8.0),Winter,Yellowish with purplish-brown centers,7-9 (USDA),China,Possibly toxic to goats
333,"Wishbone flower, bluewings, clown flower",Torenia fournieri,Linderniaceae,Annual,"6–12 inches tall, 6–9 inches wide",Partial shade,"Loamy, well-drained","Acidic, neutral","Spring, summer","Bi-colors of pale violet and dark purple, yellow and dark purple , dark purple and white, pink and white",Grows in zones 2 thru 11,Asia,
334,Air plant,Tillandsia cacticola,,Houseplant or annual,6 inches tall and 6 to 18 inches wide,"Bright, indirect light to full sun",Not applicable,Not applicable,"Once, when fully matured",White,9 to 11,Peru,
335,Black mustard,Brassica nigra,,"Herb, Annual",2 to 8 ft. tall,Full sun,"Rich, Moist Loams,",Neutral,March to June,Bright Yellow,USDA zones 4-7,"North Africa, Eurasia",
336,"Wisteria, Chinese wisteria, Japanese wisteria, American wisteria",Wisteria spp.,Fabaceae,"Deciduous, perennial vine","10 to 25 feet long, 4 to 8 feet wide","Full sun, partial shade",Well-drained,Slightly acidic to neutral,,,5 to 9 (USDA),Northern Hemisphere,
337,"Witch hazel, American witch hazel, common witch hazel",Hamamelis virginiana,,"Perennial, shrub","10-20 ft. tall, 10-20 ft. wide","Full, partial","Loamy, silt, moist but well-drained","Acidic, neutral, alkaline","Fall, winter",Yellow,"3-9, USA",North America,
338,"'Wolf Eyes' dogwood, 'Wolf Eyes' Chinese dogwood",Cornus kousa 'Wolf Eyes',,Flowering deciduous tree,15 feet tall; similar spread,Full sun to part shade,"Rich, humusy, well-drained soil",5.5 to 7.0 (slightly acidic to neutral),May to June,Pinkish white,5 to 8 (USDA),"Japan, China, Korea",
339,"Woodland phlox, wild blue phlox",Phlox divaricata,Polemoniaceae,"Herbaceous, perennial","9-12 in. tall, 9-12 in. wide","Partial, shade","Moist, well-drained",Neutral,Spring,"Purple, blue",3a-8a (USDA),North America,
340,"Yarrow, common yarrow, gordaldo, poor man's pepper, nosebleed plant, sanguinary, milfoil, soldier's woundwort, thousand-leaf, thousand-seal",Achillea millefolium,Asteraceae,Perennial,"2 to 3 ft. tall, 2 to 3 ft. wide",Full,"Sandy, loamy, clay, well-drained",Neutral,"Summer, fall","White, yellow, pink, red, purple, orange",3-9 (USDA),"Asia, Europe, North America","Toxic to cats, dogs, and horses"
341,"Youpon holly, yaupon, cassina",Ilex vomitoria,Aquifoliaceae,"Shrub, tree","10-30 ft. tall, 8-12 ft. width","Full, partial",Sandy,"Acidic, neutral",Spring,"Greenish, red",7-9 (USDA),North America,"Toxic to people , toxic to pets"
342,"Yellow alyssum, basket-of-gold, gold basket, gold dust, golden tuft, rock madwort",Aurinia saxatilis,,Herbaceous perennial,6 to 12 inches tall and 12 to 18 inches wide,Full sun,"Dry, sandy to average, well-draining",5.6 to 7.5,Spring,Yellow,3 to 7,"Asia, Europe",
343,"Yellow Bells, Yellow Elder, Esperanza, Yellow Trumpetbush",Tecoma stans,Bignoniaceae,"Perennial, shrub","3-9 ft. tall, 6-12 ft. long, 6-12 ft. wide","Full, partial","Loamy, sandy, well-drained","Neutral, alkaline","Spring, summer, fall",Yellow,10-11 (USDA),"North America, South America, Central America",
344,"Yellow birch, golden birch",Betula alleghaniensis,Betulaceae,Deciduous tree,60 in. to 70 in. tall,"Full sun, partial sun","Fertile sandy loam, well-drained","Neutral, acidic, alkaline",Spring,Yellow,3-7 (USDA),North America,
345,"Yellow coneflower, Yellow echinacea, Ozark coneflower",Echinacea paradoxa,,Perennial,2 to 3 feet tall; 1 to 1.5 feet wide,Full sun,Well-drained,Alkaline,"Summer, Fall",Yellow,3 to 9,North America,
346,"Black sapote, chocolate pudding fruit, chocolate sapote",Diospyros nigra,,Evergreen fruit tree,30-40 feet when grown outdoors;,Full sun,"Well-drained, fertile",Slightly acidic to slightly alkaline (5.5 to 7.5),,,10-11 (USDA); usually grown as a potted houseplant,Central America,
347,"Yellow corydalis, rock fumewort",Corydalis lutea,,Perennial,15 inches tall,Part shade,"Moist, well-draining soil",6.5-8,"Spring, summer, fall","Yellow, orange",05-Jul,Europe,
348,"Yellow iris, yellow flag, yellow flag iris, water flag",Iris pseudacorus,,Herbaceous perennial,3 feet tall,Full to partial sun,"Medium to wet, with average fertility",Acidic,May to June,"Yellow, with bluish-brown veins","5 to 9, USA","Europe, northwest Africa, and western Asia",
349,"Crookneck squash, Summer squash, Yellow squash",Cucurbita pepo,,"Vegetable, annual","2 feet tall, 3 to 4 feet wide",Full sun,"Loamy, well-drained",5.8 to 6.8,Summer,Yellow,3 - 10 (USDA),"North America, Central America, South America",
350,Yellow watermelon,Citrullus lanatus,,Tender annual,10-foot vines,Full sun,"Moist, rich, and loamy",Acific; 6.0 to 6.8,,,Grow as an annual in all zones,Africa,
351,Yellow wood poppy,Stylophorum diphyllum,,Perennial,12-18 in. high,Partial to full shade,"Rich, moist, well-draining",Acidic,Spring and summer,Yellow to yellow-orange,4-9 (USDA),"Canada, United States",Toxic to humans and animals
352,Yellow-twig dogwood and yellowtwig dogwood,Cornus servicea 'Flaviramea' (formerly Cornus stolonifera 'Flaviramea'),,Deciduous shrub,Five to six feet in height with a similar spread,Full sun to part shade,Consistently moist soil with high levels of organic material,5.5 to 6.5; slightly acidic,Late spring,White,3 to 8,"North America, except for lower Midwest and deep South",
353,"Yellow fritillary, yellow bells",Fritillaria pudica,Liliaceae,Perennial bulb,"4–12 in. tall, 3–8 in. wide","Full, partial","Well-drained, sandy to rocky",Mildly acidic to mildly alkaline (6.0 to 8.0),Early spring,"Yellow, reddish-orange",3–7 (USDA),Western North America,
354,"Yerba Mate Plant, Maté, Yerba Matá, Paraguay Tea",Ilex paraguariensis,,Evergreen tree/shrub,Up to 15 meters,Full Sun/Partial Shade,"Tolerates a variety, but should be well-drained","Preference for slightly acidic, but tolerates a variety",Late fall/early winter,Green White,Up to 9,Subtropical regions of South America,
355,"Yew bush, yew tree, yew shrub",Taxus,Taxaceaev,Perennial,"4 to 60 feet tall, 4 to 20 feet wide, depending on the variety","Full, partial, shade","Loamy, moist, well-drained",Neutral (5.0 to 7.0),Nonflowering,Nonflowering,Zones 2 to 10 (USDA),"Europe, Africa, Asia",Toxic to people and pets
356,Yoshino Cherry,Prunus × yedoensis,Rosaceae,Flowering tree,"30 ft. tall, 40 ft. wide",Full sun,"Average, medium moisture, well-drained",6.5 to 7.0,March to April,White to pink,USDA 5-8,Japan,
357,Black willow,Salix nigra,Salicaceae,Deciduous tree,"30-60 ft. tall, 40-60 ft. wide","Full sun, part shade","Moist, well-drained soil, wet soil",4.5 to 7.5,Early spring,Gold,USDA 4a-9a,Eastern to Midwest North America,
358,Yucca plant,Yucca spp.,Agavaceae,"Herbaceous, perennial","1-30 ft. tall, 3-15 ft. wide",Partial,"Sandy, well-draining","Neutral, acidic","Summer, fall","White, pink",4 -11 (USDA),"North America, Caribbean",Toxic to pets
359,"Zebra grass, maiden grass, Chinese silvergrass",Miscanthus sinensis 'Zebrinus',Poaceae,Ornamental grass,"7 ft. tall, 3-5 ft. wide",Full,"Chalk, clay, loam, sand",Neutral,Late summer,Silvery white,5-9 (USDA),Japan,
360,Zebra plant,Aphelandra squarrosa,Acanthaceae,Annual,"1–6 ft. tall, 1–5 ft. wide",Partial,Moist,"Neutral, acidic","Summer, fall",Yellow,11-12 (USDA),Brazil,
361,"Zigzag plant, red bird flower, fiddle flower",Euphorbia tithymaloides (formerly Pedilanthus tithymaloides),,Tropical succulent,2-3 ft. tall,"Bright, indirect sun","Rich, well-drained, slightly acidic",6.1- 7.8,Summer,"White, pink, red",9-10 (USDA),Tropical and sub-tropical North and Central America,Sap is toxic to humans and animals
362,Zinfin Doll hydrangea,Hydrangea paniculata 'Zinfin Doll',Hydrangeaceae,Shrub,"4-6 ft. tall, and 4-6 ft. wide","Full, partial",Well-drained,Neutral to acidic,Summer,"White, pink, red","3, 4, 5, 6, 7, 8",Asia,
363,"Annual geranium, zonal geranium, regal geranium, ivy-leaved geranium",Pelargonium spp. and hybrids,,"Herbaceous perennial flower, usually grown as an annual","5-36 in. tall, depending on variety",Full sun; tolerates light shade,"Rich, medium-moisture, well-drained soil",Slightly acidic (5.8 to 6.5),Flowers freely throughout season,"Red, purple, pink, magenta orange, salmon, white, bicolors",9 to 12 (USDA); grown as an annual elsewhere,Species are from Southern Africa; most are now cultivated hybrids,"Toxic to people, cats, dogs, and pets"
364,,Zygopetalum,Orchidaceae,"Perennial, epiphyte",12-24 in. tall,Partial,,,Up to 4 times annually,"Purple, burgundy, green, white, blue","9-10, USDA",Tropical South America,
365,"ZZ plant, Zanzibar gem, eternity plant",Zamioculcas zamiifolia,Araceae,Perennial,"2-4 ft. tall, 2-4 ft. wice",Partial,Well-draining,"Neutral, acidic",Spring,"Yellow, green, white",,Africa,"Toxic to humans, toxic to pets"
366,"Black-eyed Susan vine, clockvine",Thunbergia alata,Acanthaceae,"Perennial, annual, vine","3-8 ft. tall, 3-6 ft. wide","Full, partial",Well-drained,Neutral,Summer,"Orange, white, yellow, red, pink",10-11 (USDA),Africa,
367,Blackberry,Rubus Fruticosus,,Perennial,3–5 feet,Full sun,"Rich, well-drained loam",Slightly acidic to neutral (5.5 to 7.0),,,5–8,"North America, especially the Pacific Northwest",
368,"Blackberry lily, leopard lily",Iris domestica,Iridaceae,"Herbaceous, perennial","2–3 ft. tall, 9–24 in. wide",Full,Well-drained,"Acidic, neutral, alkaline",Summer,"Orange, yellow, red",5–10 (USDA),Asia,"Toxic to humans﻿﻿﻿﻿, toxic to pets"
369,"Blackhaw viburnum, blackhaw, black haw, sweet haw, stag bush, sheepberry",Viburnum prunifolium,,"Perennial, shrub","12–15 ft. tall, 6–12 ft. wide","Full, partial","Moist, well-drained",Neutral,Spring,White,3–9 (USDA),North America,
370,Blackjack oak,Quercus marilandica,Fagaceae,Deciduous tree,"20 - 40 ft. tall, 20 - 40 ft. wide",Full sun,Dry to medium well-drained soil,Acidic to neutral soil,May,,6 to 9 (USDA),Central and southeastern United States,
371,"Gallardia, blanket flower",Gaillardia x Grandiflora,Asteraceae,Herbaceous perennial,24 - 36 in. tall; 12- to 24-in. spread,Full sun,"Poor, well-draining soil",6.1 to 6.5 (slightly acidic),"Repeat bloomer, summer through fall","Various shades of red, yellow, orange, or peach",3-10 (USDA); varies by variety,Cultivated hybrid; parents are native North American wildflowers,Slightly toxic to humans
372,"Bleeding heart, common bleeding heart, fern-leaf bleeding heart",Lamprocapnos spectabilis (formerly Dicentra spectabilis),Papaveraceae,"Herbaceous, perennial","1–3 ft. tall, 2–3 ft. wide","Partial, shade","Moist, well-drained","Acidic, neutral",Spring,"Pink, white, red",3–9 (USDA),Asia,"Toxic to people, toxic to pets"
373,Air plant,Tillandsia kolbii,,Houseplant or annual,1 to 3 inches,"Bright, indirect light",Not applicable,Not applicable,"Once, when fully matured","Red, orange, or purple","9 to 11, USA",Mexico and Guatemala,
374,"Blood Lily, African Blood Lily, Fireball Lily",Scadoxus multiflorus,,Perennial,"24 in. tall, 15 in. wide",Partial,"Loamy, sandy, moist but well-drained","Acidic, Neutral, Alkaline","Summer, Fall",Red,"9-11, USA",Africa,Toxic to pets
375,'Bloodgood' Japanese maple,Acer palmatum 'Bloodgood',Aceraceae,Tree,"15-20 ft. tall, 15-20 ft wide","Full, partial","Clay, loamy, sandy, well-drained","Neutral, acidic",Summer,,5-8 (USDA),Asia,
376,"Bloomerang lilac, reblooming lilac",Syringa x,,Deciduous shrub,Four to five feet tall and wide,Full sun,Loamy,Slightly alkaline 7.5,Spring and mid-summer through fall,"Lavender, pink, purple",3a-7b,Non-native hybrid,
377,BloomStruck hydrangea,Hydrangea macrophylla 'P11HM-11',Hydrangeaceae,Deciduous shrub,"3-4 ft. tall, 4-5 ft. wide",Partial shade,"Well-draining, moist","Acidic for blue blooms, alkaline for purple or red blooms",Summer,"Blue, purple, red",4-9 (USDA),"Cultivar, no native range","Toxic to humans, toxic to dogs, cats, and horses"
378,"Blow wives, soft blow wives",Achyrachaena mollis,Asteraceae,Annual,1–2 feet tall,Full sun,Sandy loam to clay,Acidic to alkaline,"Spring, summer",Yellow,All zones (true annual),Western North America,
379,Blue ash,Fraxinus quadrangulata,Oleaceae,Deciduous tree,"50-75 ft. tall, 25–35 ft. wide",Full,"Well-drained, sandy loam",Acidic to alkaline (5.6–8.4),"Spring, summer",Purple (not showy),4–7 (USDA),North America,
380,"Blue Atlas cedar, Atlas cedar",Cedrus atlantica,Pinaceae,Tree,"40–60 ft. tall, 30–40 ft. wide","Full, partial",Well-drained,Acidic,,,6–9 (USDA),Africa,
381,"Blue beard, blue mist, blue spirea",Caryopteris × clandonensis,Lamiaceae,Deciduous shrub or woody perennial,2–4 ft. tall and wide,Full,"Medium moisture, well-drained",Neutral (6.5 to 7.5),Midsummer to early fall,"Blue, purple; pink cultivars available",6b-9a (USDA),Hybrid; parent species native to east Asia,
382,Blue Chip butterfly bush,Buddleia davidii 'Blue Chip',Scrophulariaceae,Shrub,"24-36 in. tall, 24-36 in. wide",Full,Well-drained,"Acidic, neutral","Summer, fall","Blue, purple",5-9 (USDA),"Cultivar, no native range",
383,"Dwarf morning glory, blue daze, Brazilian dwarf morning glory, evolvulus",Evolvulus glomeratus,Convolvulaceae,"Perennial, annual","9–24 in. tall, 2–3 ft. wide",Full,"Moist, well-drained","Acidic, neutral","Summer, fall",Blue,8-11 (USDA),South America,
384,Air plant,Tillandsia stricta,,Houseplant or annual,6 to 12 inches,"Bright, indirect light",Not applicable,Not applicable,"Once, when fully matured","Red, pink, blue, or purple",9 to 11,South America,
385,"Blue-eyed grass, narrow-leaved blue-eyed grass",Sisyrinchium angustifolium,Iridaceae,Perennial,"8–20 in. tall, 6–12 in. wide","Full, partial","Moist, well-drained",Acidic to neutral (5.0 to 7.0),"Late spring, early summer",Blue-violet,4–9 (USDA),Eastern North America (Northern Florida to Canada),
386,"Blue fescue, blue fescue grass",Festuca glauca,Poaceae,"Perennial, grass","6-12 in. in high, 6-18 in. spread","Full, part","Moist, well-draining","Neutral, acidic, alkaline",Summer,"Green, yellow",4-8 (USDA),Europe,
387,"Northern blue flag, blue flag, harlequin blue flag, blue flag iris, large blue iris, larger blue flag, purple iris",Iris versicolor,Iridaceae,"Perennial, herbaceous",2-3 ft. tall and wide,"Full, partial",Moist,Acidic,"Spring, summer","Blue, purple",3-9 (USDA),North America,"Toxic to humans, toxic to pets"
388,"Blue Mistflower, Blue Boneset, Wild Ageratum, Hardy Ageratum",Conoclinium coelestinum,,Perennial,"1-3 ft. tall, 1-3 ft. wide","Full, partial","Loamy, sandy, clay, moist","Mildly acidic, neutral","Summer, fall","Blue, purple",5 through 10,"Central and southeastern U.S., Canada, West Indies",
389,Blue oat grass,Helictotrichon sempervirens,Poaceae,Perennial,"2-3 ft. tall, 2-3 ft. wide",Full sun,Dry and well-drained,Slightly acidic to neutral,Summer,Blue,4-9 (USDA),Europe,
390,"Blue Princess holly, blue holly",,Aquifoliaceae,Shrub (broadleaf evergreen),"10–15 ft. tall, 8–10 ft. wide","Full, partial","Moist, well-drained","Acidic, neutral (5.0—7.0)",Spring,White,3b-7a (USDA),Nursery hybrid,Mildly toxic to people and pets
391,"Blue rug juniper, creeping juniper, carpet juniper",Juniperus horizontalis 'Wiltonii',Cupressaceae,"Evergreen shrub, groundcover","3-6 in. tall, 6-8 ft. wide",Full,Well-drained,"Acidic, neutral, alkaline",,,3-9 (USDA),North America,
392,"Mealycup sage, Victoria blue salvia, Victoria Blue flowering sage, mealy blue sage",Salvia farinacea,,Herbaceous perennial,"1–3 ft. tall, 1–2 ft. wide","Full sun, partial shade",Moist but well-drained,Neutral to acidic,"Late spring, summer, fall",Violet blue,8–10 (USDA),North America,
393,"Blue Spruce, Green Spruce, White Spruce, Colorado Spruce, Colorado Blue Spruce",Picea pungens,Pinaceae,Tree,"75 ft. high, 15-20 ft. wide.",Full,"Loamy, clay, sandy, moist, rich, well-drained","Acidic, neutral",,,2-7 (USDA),North America,
394,"Blue star creeper, swamp isotome",Isotoma fluviatilis,Campanulaceae,"Herbaceous, perennial","2–3 in. tall, 1–2 ft. wide","Full, partial","Moist, well-draining","Acidic, neutral","Spring, summer","Blue, purple",6–8 (USDA),"Australia, New Zealand",
395,"Bugleweed, common bugleweed, ajuga, carpet bugle, blue bugle, carpetweed, carpenter's herb",Ajuga reptans,Lamiaceae,Herbaceous perennial,6 to 9 in. tall and 6 to 12 in. wide,Full sun to partial shade,"Medium-moisture, well-drained",Slightly acidic 6.5,May to June,"Blue, violet",4 to 9 (USDA),"Europe, northern Africa, southwestern Asia",
396,"Blue star juniper, flaky juniper, Himalayan juniper, singleseed juniper",Juniperus squamata 'Blue Star',Cupressaceae,Shrub,"1 to 3 ft. tall, 1.5 to 3 ft. wide",Full,Sandy,"Acidic, alkaline",,,4-8 (USDA),Asia,
397,"Column cactus, blue torch cactus, woolly torch cactus",Pilosocereus,Cactaceae,Cactus,"6–12 ft. tall, 2–4 ft. wide",Full,"Sandy, Well-drained",Neutral to acidic,Summer,"White, white-yellow",9–11 (USDA),"Mexico, South America, Caribbean",
398,Blueberry,Vaccinium spp.,Ericaceae,"Fruit, perennial","One to eight feet tall, two to ten feet wide (varies by species)",Full sun,"Sandy, well-drained",Acidic (4.0 to 5.2),Spring,,3–9 (USDA) (varies by species),North America,
399,Bobo hydrangea,Hydrangea paniculata 'Ilvobo',Hydrangeaceae,Deciduous shrub,"2–3 ft. tall, 3–4 ft. wide","Full, partial","Loamy, well-drained",Acidic,Summer,White,3–8 (USDA),"Cultivar, no native range",Toxic to dogs and cats
400,"Jack-in-the-pulpit, bog onion, lord-and-lady, wake robin",Arisaema triphyllum,,Herbaceous perennial,"1-2 ft. tall, with a similar spread",Partial to full shade,"Moist, humusy",Acidic,April to May,Greenish-purple,4a-9a (USDA),Eastern North America,Toxic to people and animals
401,"Bok choy, Chinese cabbage, bok choi, pac choy, pac choi",Brassica rapa var. chinensis,Chinese brassicas,Biennial vegetable (usually grown as annual),6-24 in tall.; 6- to 18-in. spread,"Full sun, part shade","Rich, well-drained",6.5 to 7.0 (slightly acid to neutral),Summer,,2-11 (USDA),China,
402,"Boneset, American boneset, feverwort, thoroughwort",Eupatorium perfoliatum,Asteraceae,Herbaceous perennial,3-6 ft. tall and 1-4 ft. wide,"Full, partial",Moist; sandy or clay,6.5 to 7,July to September,White,"3 to 8, USDA",North America,Toxic to people
