,Common Name,Botanical Name,Family,Plant Type,Mature Size,Sun Exposure,Soil Type,Soil pH,Bloom Time,Flower Color,Hardiness Zones,Native Area,Toxicity
1013,"Liriope, lilygrass, big blue turflily (L. Muscari); creeping liriope, monkey grass (L. Spicata)",Liriope Spicata or L. Muscari,Asparagaceae,Herbaceous perennial,"9–18 in. tall, 12-24 in. spread","Full, partial","Well-draining, sandy",Acidic (6.0 to 7.0),August to September,"Lavender, white",4–10 (USDA),East and Southeast Asia,
1014,Lisbon lemon tree,Citrus x limon 'Lisbon',,Evergreen tree,Up to 15 ft. tall,Full sun,Well-drained,"Tolerant of a variety, particularly acidic types",Spring,White,9-11 (USDA),Australia with Portuguese descent,Toxic to dogs and cats
1015,"Lisianthus, prairie gentian, bluebell gentian",Eustoma russellianum (prev. Eustoma grandiflorum),Gentianaceae,"Herbaceous, perennial, annual","1–3 ft. tall, 6–12 in. wide",Full,"Moist, well-drained soil",Neutral,"Summer, fall","Purple, pink, white",8–10 (USDA),Northern America,
1016,Lithodora,"Lithodora diffusa, formerly Lithospermum diffusum",Boraginaceae,"Perennial, groundcover, herbaceous","6-10 in. tall, 24-36 in. wide","Full, partial","Sandy, well-drained",Acidic,"Spring, summer",Blue,6-8 (USDA),"Europe, Mediterranean",
1017,"Autograph tree, balsam apple, pitch apple",Clusia rosea,Clusiaceae,"Shrub, tree","8 to 25 ft. tall, 8-10 ft. wide",Full,"Sand, clay, loam, well-draining","Acidic, neutral",Summer,"White, pink",10b-11 (USDA),"Caribbean, Central America","Toxic to humans, and toxic to pets."
1018,"Little Bluestem, Beard grass",Schizachyrium scoparium,Poaceae,Ornamental perennial grass,2 - 5 ft. tall,Full sun,Various,"Acid, Neutral, Alkaline","Summer, Fall",Purple,"3 - 9, USDA",North America,
1019,"Little leaf linden, small-leaved lime",Tilia cordata,,Deciduous tree,50 to 80 feet tall and 20 to 50 feet wide,Full sun to part sun,"Well-drained rich soil, adaptable to clay","Acidic, alkaline, neutral",May through July,Lime-Yellow,"4, 5, 6, 7",Western Asia and Europe,
1020,Southern Live Oak,Quercus virginiana,Fagaceae,Broadleaf evergreen,"40-80 ft. tall, 60-100 ft. wide","Part shade, Full sun","Dry to moist, Well draining",Slightly acidic to neutral,"Early spring, May",Yellowish-Green,"8-10, USDA",Southeastern United States,
1021,"Liverleaf, Liverwort, Hepatica",Hepatica nobilis,,Perennial,Up to 5 inches,Full Sun/Partial Shade,Tolerates a variety,"Preference for alkaline, but tolerates a variety",Spring,Blue and violet,5 to 8,"Europe, Asia and North America",
1022,"Living stones, pebble plants",Lithops spp.,Aizoaceae,"Succulent, perennial","0.5–2 in. tall, 0.5–2 in. wide",Full,"Sandy, well-drained","Acidic, neutral, alkaline","Fall, early winter","White, yellow, orange",10–11 (USDA),Africa,
1023,"Lobelia, annual lobelia, edging lobelia",Lobelia erinus,Campanulaceae,Annual,"6-9 in. tall, 9-10 in. wide","Full, partial",Moist but well-drained,"Acidic, neutral","Summer, fall","Blue, pink, purple, white, red",10 to 11 (USDA),Africa,"Toxic to people, toxic to pets"
1024,"Loblolly pine, bull pine, blue pine, rosemary pine",Pinus taeda,Pinaceae,Coniferous evergreen,"40-90 ft. tall, 25-35 ft. spread",Full sun,"Moist, loamy, sandy, clay",Acidic,Non-flowering,Non-flowering,6-9 (USDA),North America,
1025,Lodgepole pine,Pinus contorta,Pinaceae,"Coniferous, evergreen",Varies; 3.5 ft. to 160 ft.,"Full, partial",Adaptable,5.0 to 7.5,June,Pale Yellow,04-Aug,North America,
1026,Lodi apple tree,Malus lodi,,Fruit tree,20 feet tall,Full sun,"Well-drained, loamy",06-Jul,July,Greenish yellow apples,03-Aug,Washington,
1027,Lombardy poplar,Populus nigra 'Italica',Salicaceae,Tree,"40-50 ft. tall, 10-15 ft. wide",Full,"Sandy, loamy",Neutral,,,3-9 (USDA),Europe,
1028,"Autumn blaze maple tree, Freeman maple",Acer x freemanii 'Autumn Blaze',Sapindaceae,Tree,"40-55 feet tall, 30-40 feet wide","Full, partial",Well-drained,Acidic,,,3-8 (USDA),North America,
1029,"London plantree, London plane, hybrid plane",Platanus × acerifolia,Platanaceae,Tree,"75-100 ft. tall, 60-75 ft. wide","Full, partial","Loamy, sandy, clay","Acidic, neutral, alkaline",Spring,"Red (female), yellow, green (male)",5-9 (USDA),"North America, Asia",
1030,"Georgia pine, hard pine, heart pine, hill pine, longleaf pine, longleaf yellow pine, Southern yellow pine, longstraw pine",Pinus palustris,Pine,Evergreen tree,80 to 100 feet,Full sun,Prefers well-drained soil but has some clay tolerance,Acidic to neutral,,,7 to 9,Southeastern U.S.,
1031,"Luffa, loofah, loofa, sponge gourd, gourd luffa, luffa sponge, smooth luffa, dishrag gourd, Egyptian luffa","Luffa aegyptiaca, Luffa cylindrica",Cucurbitaceae,Annual,"2-3 ft. tall, 8-12 ft. wide",Full,Well-drained,Acidic,Summer,Yellow,7-13 (USDA),Asia,
1032,"Loquat tree, Japanese plum, medlar, misbelief",Eriobotrya japonica,,Fruit tree,"10–25 ft. tall, 10–25 ft. wide","Full, partial","Loamy, well-drained","Acidic, neutral, alkaline","Late fall, early winter","White, blush",8–10 (USDA),China and Japan,Fruit: no; seed: yes
1033,"Chinese fringe flower, Chinese witch hazel",Loropetalum chinense,Hamamelidaceae,Shrub,10-15 ft. tall and wide,"Full, partial",Well-draining,Acidic,Spring,"Pink, red, white",7-9 (USDA),Asia,
1034,"Water lily, Lotus",Nymphaea (Water lily); Nelumbo (Lotus),Nymphaeceae (Water lily); Nelumbonaceae (Lotus),"Herbaceous, perennial","Water lily: 3-6 in. tall, 4-8 ft. wide; Lotus: 3-6 ft. tall, 3-4 ft. wide",Full,"Loamy, clay, silt, sandy",Neutral,Summer,"Water lily: blue, purple, yellow, red, white, pink, orange; Lotus: white, pink, yellow",4-10 (USDA),"Asia, Australia, North America",
1035,"Love-Lies-Bleeding, Lovelies bleeding, Tassel flower, Foxtail amaranthor love-lies-bleeding","Amaranthus caudatus (synonyms: Amaranthus edulis, Amaranthus leucocarpus, Amaranthus mantegazzianus)",,Annual,"2 to 5 ft. tall, 1 to 2 ft. wide",Full sun to part shade,"Moist, average, well-drained, or poor","Acidic, neutral",July to frost,Red,"2 to 11, USDA",American tropics (suspected),
1036,"Lowbush Blueberry, Late Sweet Blueberry",Vaccinium angustifolium,,Decicuous shrub,Up to 24 inches,Full sun/ partial shade,"Loamy, sandy, well-drained",Preference for an acidic soil,Spring,"White, with a pink tinge",2 to 7,Northeastern United States,
1037,"Lucky bamboo, friendship bamboo, ribbon plant",Dracaena sanderiana,Asparagaceae,Perennial shrub,"1–5 ft. tall, 1–2 ft. wide (indoors)",Partial shade,Water or moist but well-drained soil,Acidic,"Fall, winter (does not bloom indoors)",White,"10–11 (USDA), but typically used indoors",Africa,Toxic to animals
1038,"Lungwort, pulmonaria",Pulmonaria spp.,Boraginaceae,"Herbaceous, perennial","6–12 in. tall, 12–18 in. wide","Partial, shade","Moist, well-drained","Neutral, alkaline",Spring,"Blue, pink, white",3–8 (USDA),"Europe, Asia",
1039,"Autumn fern, Japanese shield fern, Japanese wood fern, copper shield fern",Dryopteris erythrosora,Aspleniaceae,Herbaceous perennial,"18-24 in. tall, 18-24 in. spread",Shade,"Moist, well-drained",Acidic,,,5-9 (USDA),Asia,
1040,"Lupine, bluebonnet",Lupinus x hybrida,Fabaceae,"Herbaceous, perennial, annual","3–4 ft. tall, 1–1.5 ft. wide",Full,"Rich, moist, well-drained","Acidic, neutral","Spring, summer","White, pink, red, yellow, blue, purple, bicolor",4–8 (USDA),Parent species mostly native to North America,Toxic to humans and animals
1041,"Lychee, litchi",Litchi chinensis,Sapindaceae,"Fruit, tree","20–110 ft. tall, 30-50 ft. wide",Full sun,"Moist, well-drained",Acidic,Spring,"White, yellow, green",10–11 (USDA),Asia,
1042,"Macho fern, broad sword fern",Nephrolepis biserrata,,Perennial,"3-4 ft. tall, 6 ft. wide","Partial, shade",Moist but well-draining,Acidic,,,"9a, 9b, 10a, 10b",North America,
1043,Mad pupper,"Tillandsia Bergeri, Tillandsia Aeranthos Bergeri",,"Succulent, perennial",Up to 10 in. tall,"Full sun, partial shade",,,Summer,Purple,"9 - 11, USA",South America,
1044,"Madagascar Palm, Madagascar Cactus Palm Tree, Pachypodium Species, Club Foot",Pachypodium lamerei,,Deciduous succulent (not related to true palms),"12 to 24 ft. tall, 10 to 12 ft. wide",Full sun,"Cactus compost, well-drained chalk, loam, or sand",Alkaline,Summer,"White, yellow, red, or pink","9-11, USDA",Southern Madagascar,Toxic to humans and pets
1045,"Annual vinca, Madagascar periwinkle, rosy periwinkle",Catharanthus roseus,Apocynaceae,"Herbaceous perennial, usually grown as an annual","6-18 in. tall, similar spread","Full sun, part shade",Sandy loam,6.0-7.0,June to frost,"White, pink, mauve, red","9-11 (USDA), grown as an annual elsewhere",Madagascar,"Toxic to cats, toxic to dogs, toxic to people"
1046,Madonna Lily,Lilium candidum,,Bulbous perennial,"4 to 6 ft. tall, 1 to 2 ft. wide",Full sun to part shade,"Rich, well-drained",Neutral,Spring to midsummer,White,"5-9, USDA",Middle East,Toxic to cats
1047,Magnolia 'Jane',Magnolia liliflora 'Reflorescens' x stellate 'Waterlily',Magnoliaceae,Deciduous shrub,8 to 12 feet wide and 10 to 15 feet tall,Full sun to part shade,"Organically rich, medium moisture, sandy, silty, tolerates clay soil",Neutral to slightly acidic,Spring,Purple with white interior,4-8 (USDA),United States,
1048,,Mahonia Spp.,Berberidaceae,Shrub,3 to 10 ft.,Partial shade,"Moist, Well-dained",Various,"Winter, Spring","Yellow, Red",Varies,"North & Central America, Asia",
1049,"Gingko, maidenhair",Gingko biloba,Ginkgoaceae,Tree,"50-80 ft. tall, 30-40 ft. wide","Full, partial","Sandy, well-drained","Acidic, neutral, alkaline",Spring,Green,4-9 (USDA),China,"Toxic to humans, toxic to pets."
1050,"Autumn sage, Texas sage, Red Chihuahuan sage",Salvia greggii,Lamiaceae,"Perennial, ""subshrub""",2–3 ft. tall and wide,Full,"Well-draining, fertile",Slightly acidic to slightly alkaline (6.1–7.8),Early summer to mid-fall,"Red, pink, white, violet, peach, orange",6b-9a (USDA),"Southwestern North America (Mexico, Texas, Arizona, New Mexico)",
1051,"Maidenhair fern, Delta maidenhair fern",Adiantum raddianum,Pteridaceae,Fern,"1–2 ft. tall, 1–2 ft. wide","Partial sun, shade",Moist but well-drained,Neutral,Non-flowering,None,10-11 (USDA),North America,
1052,"Majesty palm, majestic palm",Ravenea rivularis,Arecaceae,Tree,"10-100 ft.tall, 6–20 ft. wide",Partial,"Moist, well-drained",Acidic,,,10-11 (USDA),Africa,
1053,"Malabar spinach, Indian spinach, Ceylon spinach, vine spinach, climbing spinach",Basella alba,Basellaceae,Vegetable,"6 to 10 ft. long, 2 to 3 ft. wide",Full sun,"Loamy, sandy, moist but well-drained",Neutral to acidic (6.5 to 6.8),,,"7-10, USA","Tropical south and southeast Asia, Indian subcontinent",
1054,"'Miss Kim' lilac, Manchurian lilac",Syringa pubescens subsp. patula 'Miss Kim',,Flowering deciduous shrub,6-8 feet tall and wide,Full sun,Loamy,Neutral to slightly alkaline (pH 7.0–8.0),Spring to early summer,Lavender-purple,4–8 (USDA),"Eastern Asia (Korea, Manchuria)",
1055,"Mandevilla, rocktrumpet",Mandevilla spp.,Apocynaceae,Vine,"3–10 ft. tall, 3–4 ft. wide","Full, partial",Moist but well-drained,"Neutral, acidic","Summer, fall","Pink, red, white",10–11 (USDA),"North America, Central America, South America",
1056,Mango,Mangifera indica,Anacardiaceae,"Fruit, tree","Up to 100 ft. tall, 35 ft. wide",Full sun,"Loamy, moist, well-drained","Acidic, neutral, alkaline",Winter,,9–11 (USDA),Asia,Toxic to people
1057,"Manila palm, Christmas palm",Adonidia merrillii,Arecaceae,Tree,"15-25 ft. tall, 5-8 ft. wide",Full sun,"Clay, sandy, loamy, well-drained",Neutral to alkaline,Summer,Cream,10-11 (USDA),Asia,
1058,"Manjula pothos, happy leaf pothos, HANSOTI14, jewel pothos",Epipremnum aureum ‘HANSOTI14’,Araceae,"Perennial, vine","6 ft long, 3 ft wide (indoors)",Partial,"Loamy, moist but well-drained",Acidic,,,"11a, 11b, 12a, 12b",Australia,"Toxic to cats, toxic to dogs"
1059,"New Zealand tea tree, tea tree, broom tea tree, manuka",Leptospermum scoparium,Myrtaceae,"Shrub, tree",6–10 ft. tall and wide,Full,Well-draining,Acidic,Summer,"White, pink, red",9–10 (USDA),"New Zealand, Australia",
1060,Marble queen pothos,Epipremnum aureum 'Marble Queen',Araceae,"Perennial, vine","10 ft long, 3 ft wide (indoors)",Partial,"Loamy, moist but well-draining",Acidic,"Spring, summer","Green, white","11a, 11b, 12a, 12b",Australia,
1061,Avocado Tree,Persea americana,Lauraceae,"Tree, Fruit","60 ft. tall, 30 ft. wide","Full, Partial","Loamy, Sandy, Well-drained","Acidic, Neutral","Late Winter, Spring, Early Summer","Yellow, Green","9-11, USA","North America, Central America, Asia",Toxic to pets
1062,Marigold,Tagetes spp.,Asteraceae,"Herbaceous, annual","4–48 in. tall, 6–24 in. wide",Full,"Evenly moist, well-drained",Slightly acidic to neutral (6.0 to 7.0),Summer,"Yellow, orange, white, red, gold, bicolor",2-11 (USDA); annual in all zones,Southern North America (Mexico),
1063,"Marsh marigold, yellow marsh marigold, cowslip, caltha cowslip, cowflock, May blob, kingcup",Caltha palustris,,Herbaceous perennial,"1–2 ft. tall, 12 to 18 in. wide","Full, partial","Loamy, moist to wet",Acidic,Spring,Yellow,3–7 (USDA),North America (northern temperate regions),Toxic to humans and animals
1064,"Marshmallow, marsh mallow",Althaea officinalis,Malvaceae,"Perennial, herb","4-5 ft. tall, 2 ft. wide",Full,Moist,"Acidic, neutral, alkaline",Summer,"White, pink",3-7 (USDA),"Europe, Asia, Africa",
1065,Mask Flower,Alonsoa,,Annual/Perennial,24-30 inches,Full sun,"Well-drained, light, fertile",6.1-7.8,Summer/Early fall,Red/Orange,09-Nov,Central/western South America,
1066,"Masterwort, Hattie's pincushion",Astrantia,"Apiaceae, aka Umbelliferae",Perennial,"1-3 ft. tall, 1-2 ft. wide",Partial,"Moist, well-drained","Acidic, neutral","Spring, summer","Green, purple, red, white, pink",4-9 (USDA),Europe,
1067,Mastic Tree,Pistacia lentiscus,Anacardiaceae,Broadleaf Evergreen,"15-25 ft. tall,, 20- 30 ft. wide",Full sun,"Dry, Sandy, Well Draining",Alkaline,Spring,Inconspicuous green,"Zones 9-11, USDA",Mediterranean area,
1068,"Matilija poppy, fried egg plant, California tree poppy",Romneya coulteri,,Tender perennial,6 to 10 feet tall,Full sun,"Sandy loam, tolerant of all soils",5 to 8,March to August,White,USDA 8 to 10,"California, northern Mexico",
1069,"Mayapple, American mandrake, wild mandrake, Indian apple, duck's foot",Podophyllum peltatum,,Herbaceous perennial,"12-18 in. tall, 9-12 in. wide",Part shade to full shade,"Humusy, well-drained soil",4.6-7.0 (acidic to neutral),April,White,3-8 (USDA),"Eastern North America, Southern U.S. to Texas",Toxic to humans and animals
1070,Meadow rue,Thalictrum spp.,Ranunculaceae,Herbaceous perennial,"1–8 ft. tall, 1–5 ft. wide (varies by species)","Full, partial","Well-drained, rich, humusy",Acidic to alkaline (5.0-8.0); varies by species,"Spring, summer (varies by species)","Light purple or pink, white, yellow (varies by species)",3–7 (varies by species),North Hemisphere,May cause skin irritation; T. delavayi may be toxic to pets
1071,"Medinilla, rose grape, showy medinilla, Philippine orchid, pink lantern plant",Mednilla magnifica,,Broadleaf evergreen,2 to 4 feet tall; 1- to 3-foot spread,Part shade,Well-drained potting mix,6.1 to 6.5 (slightly acidic),Sporadically from April to August,Pink to coral red,10 to 11 (USDA),"Phillipines, Java, Malay Peninsula, Sumatra.",
1072,Azalea,Rhododendron spp.,Ericaceae,Deciduous or evergreen shrub,"3–20 ft. tall, wide",1072,"Light, well-drained",Acidic (4.5 to 6.0),Early spring to summer,"White, pink, red, orange, peach",6b-8a (USDA); varies by species,"Asia, Europe, North America",Toxic to humans and pets
1073,"European fan palm, Mediterranean fan palm, Mediterranean dwarf palm",Chamaerops humilis,Arecaceae,"Tree, shrub","6–15 ft. tall, 6–20 ft. wide","Full, partial","Loamy, moist, well-drained","Acidic, neutral, alkaline",Spring,Yellow,8-11 (USDA),Mediterranean,
1074,"Melon cactus, Turk's cap cactus",Melocactus,Cactaceae,Cactus,"Up to 3 ft. tall, 1 ft. wide",Full,"Sandy, well-drained","Acidic, neutral",Summer,"Pink, red","10, 11","Central America, South America",
1075,Mexican bush sage,Salvia leucantha,Lamiaceae,Perennial,"4 ft. tall, 3 ft. wide",Full,Moist but well-drained,"Acidic, neutral, alkaline",Summer,"Purple, white, blue",8-11 (USDA),"North America, Central America",
1076,"Mexican fleabane, Mexican daisy, seaside daisy",Erigeron karvinskianus,,"Perennial, herbaceous",Up to 2 ft. tall,"Full sun, partial shade",Well-drained,"Acid, neutral, alkaline","Spring, summer, fall",White to pink and purple,"5 - 9, USA",Mexico,
1077,"Mexican Fan Palm, Skyduster",Washingtonia robusta,Arecaceae,Tree,"50-100 ft. tall, 8-10 ft. wide",Full,"Loamy, Sandy, Silt, Well-drained","Acidic, Neutral",Summer,"Yellow, White","9-11, USA",Central America,
1078,"Mexican feather grass, Mexican feathergrass, Mexican wiregrass, pony tails, silky thread grass, Texas tussock","Nassella tenuissima (formerly, Stipa tenuissima)",,Perennial ornamental grass,"24 in. tall, with a slightly greater spread",Full sun to partial sun,Loamy,Slightly acidic to slightly alkaline,Mid-summer,"Begins greenish, matures to a golden-brown, fades to a tan",7-10 (USDA),"South America, Central America, parts of the American Southwest",
1079,Mexican firecracker,Echeveria setosa,,"Perennial, evergreen",12 inches tall and 3 inches wide,Full to partial sun,"Sandy, well-draining",Slightly acidic,Late spring,Red and yellow,"9 to 11, USA",Mexico,
1080,"Mexican hat, prairie coneflower, thimbleflower",Ratibida columnifera,,Perennial,"Up to 3 ft. tall, 18 in. wide",Full,"Loamy, sandy, well-drained","Neutral, alkaline","Spring, summer, fall","Orange, yellow, brown","4 to 9, USDA",North America (Mexico),
1081,"Mexican Heather, Elfin Herb, False Heather, Hawaiian Heather",Cuphea hyssopifolia,Lythraceae,Evergreen shrub,"1 to 2 ft. tall, 1 to 4 ft. wide",Full sun to light/part shade,"Loam or Clay (Average, medium, well-drained)",Slightly acidic (5.5 to 7),Summer to frost,"Purple, Pink, White","9b-11, USDA","Central America (Mexico, Guatemala, Honduras)",Toxic
1082,"African marigold, Mexican marigold, Aztec marigold, American marigold",Tagetes erecta,Asteraceae,Annual,"1–4 ft. tall, 1–2 ft. wide",Full,"Sandy, loamy, well-drained","Acidic, neutral","Summer, fall","Orange, yellow, white",2–11 (USDA),"North America, Central America",Toxic to humans
1083,"Baby rubber plant, pepper elder, radiator plant, shining bush plant, emerald ripper pepper","Peperomia spp. (including P. caperata, P. obtusifolia, and others)",Piperaceae,"Perennial, epiphyte","6–12 in. tall, 6–12 in. wide",Full or partial,Moist but well-drained,Neutral to acidic,Summer,"White, green, brown",10–12 (USDA),"Central America, South America, and the Caribbean",
1084,"Mexican orange, Mexican orange blossom, Mexican orange flower, mock orange.",Choisya ternata,Rutaceae,Broadleaf evergreen shrub,"6-8 ft. tall, 6–8 ft. wide","Full, partial","Fertile, well-drained",Slightly acidic,Summer,White,7–10 (USDA),"Southern North America, Mexico",
1085,"Mexican petunia, Mexican bluebell, Britton's petunia",Ruellia brittoniana or Ruellia simplex,Acanthaceae,"Perennial, rhizome","1-4 ft. tall, 1-3 ft. long, 1-3 ft. wide","Full, partial","Loamy, sandy, moist but well-drained","Acidic, neutral","Summer, fall",Purple,"8-11, USDA","North America, South America, Caribbean",
1086,"Pink evening primrose, showy evening primrose, pinkladies, Mexican primrose",Oenothera speciosa,Onagraceae,Herbacious perennial,"12–18 in. tall, 12–18 in. wide",Full,"Loose, well-draining; tolerates rocky poor soil",Slightly acidic to neutral,"Summer, fall","White, pale pink",5–8 (USDA),North America,
1087,"Mexican Gem, Mexican Snowball, White Mexican Rose",Echeveria elegans,,Succulent,"6 to 8 inches tall, 12 inches wide",Full sun,"Sandy, well-drained",Acidic,"Spring, summer","Pink, yellow",09-Nov,North America,
1088,"Mexican Sunflower, tree marigold",Tithonia rotundifolia,Asteraceae,"Annual, perennial",3-8 ft. tall,Full,"Sandy, well-drained",Acidic,"Summer, fall","Yellow, orange",9-11 (USDA),"North America, Central America",
1089,Meyer lemon,Citrus x meyeri,Rutaceae,"Tree, shrub","6–10 ft. tall, 4–8 ft. wide","Full, partial","Sandy, well-draining","Neutral, acidic","Fall, spring",White,9–11 (USDA),China,Toxic to pets
1090,Milk thistle,Silybum marianum,,"Herbaceous, biennial","2-6 ft, tall, 1-3 ft. wide",1090,"Loamy, sandy, clay, silt",,Summer,Purple,5-9 (USDA),Europe,
1091,"Milkweed, common milkweed",Asclepias syriaca,Apocynaceae/Asclepiadaceae,Herbaceous perennial,2 to 4 ft. tall,Full sun,"Any well-drained soil; tolerates clay soil and poor, dry conditions",4.8 to 7.2,June to August,"Pink, mauve, white",3 to 9 (USDA),Eastern United States,Toxic to humans and animals
1092,"Million bells, trailing petunia, mini petunia",Calibrachoa,,"Herbaceous perennial, annual",3 to 9 inches tall and 6 to 24 inches wide,Full sun,"Rich, moist, well-draining",5.2 to 6,Spring to frost,"Pink, yellow, red, violet, white, blue, magenta, bronze",9 to 11,South American hybrid,
1093,Pansy orchid,"Miltonia, Miltoniopsis",Orchidaceae,Perennial,12-20 in. tall,Indirect sun to part shade,"Fir bark, moss, pebbles",,Species specific,"Red, yellow, green, white, brown","11-12, USDA","Brazil, Colombia to Costa Rica",
1094,"Baby rubber plant, pepper face plant",Peperomia Obtusifolia,Piperaceae,"Perennial, Herbaceous",Up to 1 ft. tall,Partial,"Clay, Sand, Loam","Acidic, Neutral, Alkaline",Periodic through the year,White,10-12 (USDA),South America,
1095,Ming aralia,Polyscias fruticosa,Araliaceae,Shrub,"6–8 ft. tall, 2–3 ft. wide",Partial,"Loamy, well-drained",Acidic,Summer,"Yellow, white",11–12 (USDA),Asia,Toxic to pets and humans
1096,Mini cyclamen,Cyclamen persicum,Primulaceae,"Perennial, tuber","4-6 in. tall, 4-6 in. wide","Partial, shade","Loamy, well-drained","Acidic, neutral",Winter,"Red, pink, white","10-11, USA","Europe, Mediterranean","Toxic to humans, toxic to pets"
1097,"Mini monstera, Philodendron/monstera ""Ginny"", Philodendron ""Piccolo"", Monstera minima",Rhaphidophora tetrasperma,Araceae,"Perennial, vine","6-8 ft. tall (indoors), 15-20 ft. tall (outdoors)",Partial,Moist but well-draining,"Acidic, neutral","Spring, summer","Green, white","9b, 10a, 10b, 11a, 11b, 12a, 12b","Africa, Asia",
1098,"Miniature rose, rose",Rosa spp.,Rosaceae,Deciduous shrub,"1–2 ft. tall, 1–2 ft. wide",Full sun,Moist but well-drained,Neutral to acidic,"Late spring, summer","Pink, red, yellow, white",5–9 (USDA),None; miniature roses are a cultivated creation,
1099,Mint,Mentha spp.,Lamiaceae,"Perennial, herb","12–18 in. tall, 18–24 in. wide","Full, partial","Loamy, moist, well-drained","Acidic, neutral",Summer,,"3–11, USA (depends on species)","North America, Africa, Australia",Toxic to animals
1100,Mistletoe cactus,Rhipsalis spp.,,llthophytic or epiphytic cacti,1–20 feet (depends on species and age of plant),Part shade to full shade,Porous cactus potting mix with organic matter,5.0 to 6.5 (acidic),Year-round when grown in ideal conditions; varies by species.,White or creamy yellow,9–11 (USDA),"South America, tropical, Africa",
1101,"Mistletoe cactus, chain cactus, spaghetti cactus, Rhipsalis",Rhipsalis baccifera,Cactaceae,Succulent,"6 ft. long, 2 ft. spread (indoors), 30 ft. long, 5 ft. spread (outdoors)","Partial, shade",Moist but well-drained,Acidic,"Spring, summer","White, green","9a, 9b, 10a, 10b","South America, Central America, Africa",
1102,"Mizuna kyona, shui cai",Brassica rapa var. japonica (synonym: Brassica rapa nipposinica),,Biennial green,"5 to 7 inches high, 10 to 15 inches wide","Full sun, partial shade","Well-drained, rich soil",Neutral (6.5 to 7.0),Spring (not typically grown for flowers),Yellow,4 to 9,Kansai region of Japan,
1103,"Orange jasmine, orange jessamine, satinwood, mock orange","Murraya paniculata, Chalcas paniculata",Rutaceae,Shrub,"8-12 ft. tall, 8-12 ft. wide","Full, partial","Loamy, well-drained","Acidic, neutral, alkaline","Spring, summer, fall",White,10-12 (USDA),"Asia, Australia",
1104,"Mock orange, mock orange shrub, sweet mock orange, English dogwood",Philadelphus coronarius,Hydrangeaceae,Shrub,10–12 ft. tall and wide,"Full, partial","Loamy, moist, well-drained","Acidic, neutral","Spring, summer",White,"4–8, USA",Europe,
1105,"African milk tree, African milk bush",Euphorbia trigona,Euphorbiaceae,Succulent,"6-9 ft. tall, 1-2 ft. wide",Partial,"Loamy, well-drained",Neutral,"Spring, summer",White,9b-11 (USDA),Africa,"Toxic to humans, toxic to pets"
1106,"Baby tears, baby's tears, angel's tears",Soleirolia soleirolii,Urticaceae,"Herbaceous perennial, often grown as an annual",4 in. tall; 36 in. wide,Partial sun to shade,"Rich, moist loam",5.0 to 6.0 ( slightly acidic),Late spring to early summer; May to June,Creamy ivory,9 to 11 (USDA),Mediterranean,
1107,"Mock strawberry, false strawberry, Indian strawberry, and Indian mock strawberry","Potentilla indica, formerly Duchesnea indica, originally Fragaria indica",,"Fruit-bearing, deciduous groundcover",2.5 inches tall,Full sun to partial shade,Humus rich,Mildly acidic to mildly alkaline,April to June,Yellow/gold,"5-9, USDA",Asia (Afghanistan to Russian Far East),
1108,"Mona Lavender, 'Mona Lavender' plectranthus, lavender spur flower",Plectranthus 'Mona Lavender',Lamiaceae,"Perennial, shrub","1-2 ft. tall, 1–2 ft. wide",Partial,"Rich, well-drained",Acidic,"Fall, winter",Purple,10-11 (USDA),"Cultivar, no native range",
1109,"Money tree, Guiana chestnut",Pachira aquatica,,Tree,,1109,,,,,,,
1110,"Monkey grass, black mondo grass",Ophiopogon planiscapus 'Nigrescens',,Herbaceous perennial,9 to 12 inches tall and wide,Full sun to part shade,"Moist, well-drained",5.5 to 6.5,July to August,Pink,6 to 9,Japan,
